{
  "id": "data-cleaning",
  "version": "0.1.1",
  "description": "数据处理",
  "input_schema": "contracts/input.schema.json",
  "output_schema": "contracts/output.schema.json",
  "required_tools": [
    "inspect_dataset",
    "propose_workflow_patch"
  ],
  "operator_dependencies": {
    "inspect": "1"
  },
  "evaluation_suite": "data-cleaning-core-v1"
}
